,Title,Channel,url,video_list,Training
0,Diddler Gets Shot In The Dingaling!,Donut Operator,https://www.youtube.com/watch?v=63twaXPVfs4,Gun-type,True
1,Cop Vs. Katana Wielding Neckbeard,Donut Operator,https://www.youtube.com/watch?v=xHYIPhfj8E8,Gun-type,True
2,Why U.S Military Drills Freak Out North Korea,Task & Purpose,https://www.youtube.com/watch?v=7cS9H7FUpf0,Gun-type,True
3,Russian Tactical Nuke Exercise - War Map Comparison - US Soldier Detained,Preston Stewart,https://www.youtube.com/watch?v=4VgQ-3MJ3TI,Gun-type,True
4,IDF Begins Major Operation in Southern Gaza - Problems with Ceasefire Proposal,Preston Stewart,https://www.youtube.com/watch?v=KLo6CZp-PUs,Gun-type,True
5,FAMOUS Hollywood Producer CAUGHT Meeting 15 YEAR OLD?,The Officer Tatum,https://www.youtube.com/watch?v=vdjxCaL1hSA,Gun-type,True
6,"Inside The UCLA Student Protests: Ideologies, Concerns & Seeking an Opportunity for Peace",Preston Stewart,https://www.youtube.com/watch?v=toMCLB_8xw4,Gun-type,True
7,Fridays With Frank 104: Cool Dude Attitude,Pinal County Sheriff's Office,https://www.youtube.com/watch?v=NB2t2j4P1Xs,Gun-type,True
8,The Calmest Cop Ever Gives The Angriest Motorist a Ticket - 1992,PoliceActivity Archive,https://www.youtube.com/watch?v=HnWy3Eh352w,Gun-type,True
9,Fridays With Frank 99: Not Empatheticless,Pinal County Sheriff's Office,https://www.youtube.com/watch?v=GvgHA0CDBNE,Gun-type,True
10,"CONGRESS UPDATE, FALLOUT, AND CIVIL WAR",Brandon Herrera,https://www.youtube.com/watch?v=8mSSGdpXWog,Gun-type,True
11,ASSAULT ACORN ATTACKS COP,Brandon Herrera,https://www.youtube.com/watch?v=UnvRVSPg3yg,Gun-type,True
12,How to Dodge Missiles | using SOUND,Civ Div,https://www.youtube.com/watch?v=oKFK9QXYEM0,Gun-type,True
13,We Eliminated 10 Russian Invaders,Civ Div,https://www.youtube.com/watch?v=7etgUq9dA60,Gun-type,True
14,The ATF Battle & Cult of Waco…,Popo Medic,https://www.youtube.com/watch?v=xkbXcdPFCWY,Gun-type,True
15,Are Ukrainians using Abrams Tanks Wrong? US Tank Commander gives insight.,RedEffect,https://www.youtube.com/watch?v=WW0hUfdrGbA,Gun-type,True
16,North Korea's NEW Tank is a Nightmare,Task & Purpose,https://www.youtube.com/watch?v=uQfgE6nRUV4,Gun-type,True
17,Oklahoma State Trooper Stays Calm While Being Shot At During High Speed Chase,PoliceActivity,https://www.youtube.com/watch?v=UHEjqrNksSI,Gun-type,True
18,California Dreamin' in Baghdad,Veteran Files,https://www.youtube.com/watch?v=zXMB0DOV7j0,Gun-type,True
19,Must See: Armed Veteran Jewelry Store Owner Forces Thief to Leap Through Shattered Window in Omaha,Colion Noir,https://www.youtube.com/watch?v=7kWmqoTKiRk,Gun-type,True
20,Home Invasions Plummet After Florida Sheriff Says Shoot Home Invaders To Save Tax Payers Money,Colion Noir,https://www.youtube.com/watch?v=wGZRuyZuWZI,Gun-type,True
21,How to SURVIVE in War,Civ Div,https://www.youtube.com/watch?v=Aj7aufhLfWA,Gun-type,True
22,We Test The US Military's Newly Adopted .277 Fury Round,Garand Thumb,https://www.youtube.com/watch?v=tTAfS1addXU,Gun-type,True
23,BASED Frat Boys DEFEND American Flag On UNC Campus!,The Officer Tatum,https://www.youtube.com/watch?v=iJUbIitTn-o,Gun-type,True
24,Criminals Aren’t the Only Ones Doing Drive By Shootings….,Donut Operator,https://www.youtube.com/watch?v=K91zYE0AtFc,Gun-type,True
25,"Green Beret Shot And Treated On Battlefield, Walks Off Like A Boss",FUNKER530 - Veteran Community & Combat Footage,https://www.youtube.com/watch?v=6Nw_tHq5IhY,Gun-type,True
26,They Kidnapped The SAS And FOUND OUT… (*ACTUAL FOOTAGE*),Popo Medic,https://www.youtube.com/watch?v=6zPp86tyf6E,Gun-type,True
27,SEAL Team Six SMOKED Some Pirates in 2012… (*BUCHANAN RAID FOOTAGE*),Popo Medic,https://www.youtube.com/watch?v=Y34jR7Up5Z8,Gun-type,True
28,When Criminals Use WEAPONS in Police Stations!,Ex Cop,https://www.youtube.com/watch?v=-o8HIpHYt0Q,Gun-type,True
29,Up-Close Look at Captured Abrams and Leopard in Moscow,Real Reporter,https://www.youtube.com/watch?v=HBdf4Dk_LqY,Gun-type,True
30,Military Tank Expert Rates 8 Tank Battles In Movies And TV | How Real Is It? | Insider,Insider,https://www.youtube.com/watch?v=4mjvZrLnlCg,Gun-type,False
31,WWII Air Force Expert Rates 8 Dogfights In Movies | How Real Is It? | Insider,Insider,https://www.youtube.com/watch?v=1VDeLnOkcs8,Gun-type,False
32,Ninja Master Rates 8 Ninjutsu Fights In Movies and TV | How Real Is It? | Insider,Insider,https://www.youtube.com/watch?v=gPymxSUNXeU,Gun-type,False
33,Urban-Warfare Expert Rates 11 Urban-Warfare Scenes In Movies And TV | How Real Is It? | Insider,Insider,https://www.youtube.com/watch?v=oDLoH-EsA8c,Gun-type,False
34,Weapons Masters Rate 85 Fight Scenes in Movies and TV | How Real Is It? | Insider,Insider,https://www.youtube.com/watch?v=rOAMYgaPTmU,Gun-type,False
35,Former Bank Robber Breaks Down 9 More Bank Heists In Movies and TV | How Real Is It? | Insider,Insider,https://www.youtube.com/watch?v=yH3gFE15Ivc,Gun-type,False
36,Nuclear-Weapons Expert Breaks Down 8 Nuclear Bombs In Movies And TV | How Real Is It? | Insider,Insider,https://www.youtube.com/watch?v=j9dXwEdJDZc,Gun-type,False
37,Lion Expert Rates 9 Big-Cat Attacks In Movies | How Real Is It? | Insider,Insider,https://www.youtube.com/watch?v=T2cx5tecP6c,Gun-type,False
38,Civil War Historian Rates 9 American Civil War Battles In Movies | How Real Is It? | Insider,Insider,https://www.youtube.com/watch?v=uJsKy_XN850,Gun-type,False
39,Cruise Ship Captain Breaks Down 8 Cruise Disasters In Movies And TV | How Real Is It? | Insider,Insider,https://www.youtube.com/watch?v=ZsioZ5Iyrr8,Gun-type,False
40,Special Ops Sniper Rates 11 More Sniper Scenes In Movies And TV | How Real Is It? | Insider,Insider,https://www.youtube.com/watch?v=jlx548y1NDY,Gun-type,False
41,Survivorman Les Stroud Rates 9 Desert-Survival Scenes In Movies And TV | How Real Is It? | Insider,Insider,https://www.youtube.com/watch?v=HycbibRLSOY,Gun-type,False
42,Jungle Survivalist Rates 10 Jungle Survivals In Movies | How Real Is It? | Insider,Insider,https://www.youtube.com/watch?v=gnqYejwwAh4,Gun-type,False
43,Special Ops Bomb Tech Rates 11 Bomb Disposals in Movies and TV | How Real Is It? | Insider,Insider,https://www.youtube.com/watch?v=XBpb-eIrfxs,Gun-type,False
44,Military Experts Rate 70 Military Battles In Movies And TV | How Real Is It? | Insider,Insider,https://www.youtube.com/watch?v=5hCKDPSSVi0,Gun-type,False
45,Afghan War Veteran Rates 9 Afghanistan War Battles In Movies | How Real Is It? | Insider,Insider,https://www.youtube.com/watch?v=pvD0H9p7T0I,Gun-type,False
46,Traditional Archery Expert Rates 11 More Archers In Movies | How Real Is It? | Insider,Insider,https://www.youtube.com/watch?v=KXxmgv_0LYc,Gun-type,False
47,Crocodile Wrangler Rates 12 Alligator Attacks In Movies And TV | How Real Is It? | Insider,Insider,https://www.youtube.com/watch?v=ighwvLdGOQ8,Gun-type,False
48,Vietnam War Historian Breaks Down 8 Vietnam War Scenes In Movies And TV | How Real Is It? | Insider,Insider,https://www.youtube.com/watch?v=2kWuqq8pb7Q,Gun-type,False
49,Vietnam War Historian Breaks Down 7 More Vietnam War Scenes In Movies | How Real Is It? | Insider,Insider,https://www.youtube.com/watch?v=5kS4K7_hGAI,Gun-type,False
50,Snake Expert Rates 9 Snake Attacks In Movies | How Real Is It? | Insider,Insider,https://www.youtube.com/watch?v=L6itaIfIXvw,Gun-type,False
51,Warfare Historians Rate 51 Military Battles In Movies And TV | How Real Is It? | Insider Marathon,Insider,https://www.youtube.com/watch?v=ftoJihCFxcY,Gun-type,False
52,Iraq War Veteran Rates 10 Iraq War Battles In Movies & TV Shows | How Real Is It? | Insider,Insider,https://www.youtube.com/watch?v=amiBT5iTM7U,Gun-type,False
53,Pirate Historian Rates 8 Pirate Battles In Movies And TV | How Real Is It? | Insider,Insider,https://www.youtube.com/watch?v=5eyGS92JInY,Gun-type,False
54,Cold War Historian Rates 9 Cold War Clashes In Movies | How Real Is It? | Insider,Insider,https://www.youtube.com/watch?v=c6m8bkbb5pQ,Gun-type,False
55,Military Dog Handler Rates 8 Military Dogs In Movies And TV | How Real Is It? | Insider,Insider,https://www.youtube.com/watch?v=93s-Hn_dfkQ,Gun-type,False
56,Army Special Ops Rates Every 'John Wick' Movie | How Real Is It | Insider,Insider,https://www.youtube.com/watch?v=4KSPN3JBQaA,Gun-type,False
57,NYC Firefighter Rates 10 Firefighting Scenes In Movies And TV | How Real Is It? | Insider,Insider,https://www.youtube.com/watch?v=d6N5Pt7lP8g,Gun-type,False
58,Weapons Masters Rate 85 Fight Scenes in Movies and TV | How Real Is It? | Insider,Insider,https://www.youtube.com/watch?v=rOAMYgaPTmU,Gun-type,False
59,Former Bank Robber Breaks Down 9 More Bank Heists In Movies and TV | How Real Is It? | Insider,Insider,https://www.youtube.com/watch?v=yH3gFE15Ivc,Gun-type,False
